id;testId;query
476;34;Чувствительность органа (ткани) к ионизирующей радиации повышается: а) при гипоксии; б) при дефиците витамина Е; в) в процессе регенерации ткани; г) в присутствии цитостатических препаратов; д) при гипертермии; е) при избытке кислорода.
477;34;Главная мишень в клетке при действии на нее ионизирующей радиации:
478;34;Радиационному повреждению клеток способствуют: а) повышение содержания кислорода в крови; б) понижение содержания кислорода в крови; в) недостаток витамина Е; г) высокая митотическая активность; д) низкая митотическая активность.
479;34;Механизмы повреждения клетки: а) повышение сопряженности окислительного фосфорилирования; б) повышение активности ферментов системы репарации ДНК; в) усиление свободнорадикального окисления липидов; г) выход лизосомальных ферментов в гиалоплазму; д) экспрессия онкогена.
480;34;Ферменты антимутационной системы клетки: а) рестриктаза; б) гистаминаза; в) гиалуронидаза; г) ДНК-полимераза; д) креа-тинфосфаткиназа; е) лигаза.
481;34;Увеличение содержания свободного ионизированного кальция в клетке сопровождается: а) активацией фосфолипазы А2; б) инактивацией фосфолипазы С; в) активацией перекисиого окисления липидов; г) гиперполяризацией цитоплазматической мембраны; д) увеличением выхода К из клетки; е) гипергидратацией клетки.
482;34;Последствия выраженного ацидоза при ишемическом повреждении кардиомиоцитов: а) 4-Са++ - транспортирующей функции саркоплазматического ретукулума; б) активация Na+/K+-АТФ-азы; в) инактивация лизосомальных протеаз и фосфолипаз; г) активация перекисного окисления липидов; д) снижение сократительной функции миофибрилл; е) активация ферментов креатинкиназной системы.
483;35;Дайте описание «лица Корвизара»:
484;35;Дайте описание «воротника Стокса»:
485;35;Дайте описание «fades nephritica»:
486;35;Дайте описание «лица Гиппократа»:
487;35;У больного имеются суточные колебания температуры тела в пределах 36,6-40,2°С. Повышению температуры предшествует сильный озноб; снижение сопровождается изнуряющим потоотделением. Укажите тип температурной кривой:
488;35;У больного отмечаются суточные колебания температуры тела в пределах 37,0-39,0°С. Укажите тип температурной кривой:
489;35;Объясните происхождение симптомов «сосудистые звездочки» и «печеночные ладони», выявляемых при общем осмотре:
490;35;Объясните происхождение койлонихий, выявляемых при общем осмотре:
491;35;Объясните происхождение гинекомастии у мужчин, выявляемой при общем осмотре:
492;35;Объясните происхождение снижения тургора кожи, выявляемого при общем осмотре:
493;35;Объясните происхождение ангулярного стоматита и трещин кожи, выявляемых при общем осмотре:
494;36;Период полувыведения лекарства - это:
495;36;Широта терапевтического действия - это:
496;36;К рецепторным средствам конкурентного действия относятся:
497;36;Функцию печени и почек следует учитывать при назначении следующих лекарственных средств:
498;36;Селективность действия лекарственного вещества зависит от:
499;36;Для кинетики насыщения характерно:
500;36;Фактор, определяющий необходимость перерасчета режима введения препарата при ХПН:
501;36;Какие препараты с большей легкостью проходят через ГЭБ?
502;36;В каком случае происходит более полное всасывание?
503;36;В понятие «пресистемный метаболизм» входит:
504;37;В классификации грыж пищеводного отверстия диафрагмы выделяют все перечисленные формы, исключая:
505;37;Причинами возникновения аксиальной грыжи являются все перечисленные,  кроме:
506;37;Клиническая картина грыжи пищеводного отверстия диафрагмы включает все  перечисленные симптомы, за исключением:
507;37;К эндоскопическим критериям аксиальной грыжи относятся все перечисленные, кроме:
508;37;К эндоскопическим признакам аксиальной грыжи относятся все перечисленные, исключая:
509;37;Источниками кровотечения при аксиальной грыже являются все перечисленные, кроме:
510;37;К осложнениям аксиальной грыжи относятся все перечисленные, кроме:
511;37;Эндоскопическими критериями эзофагита являются все перечисленные, исключая:
512;37;К эндоскопическим критериям эзофагита легкой степени относится:
513;37;К эндоскопическим критериям эзофагита средней степени относится:
514;37;К эндоскопическим критериям эзофагита тяжелой степени относятся:
515;37;К эндоскопическим критериям эзофагита легкой степени относятся все перечисленные, исключая:
516;37;К эндоскопическим критериям эзофагита средней степени относятся все перечисленные, за исключением:
517;37;К эндоскопическим критериям эзофагита тяжелой степени относятся все перечисленные, за исключением:
518;38;Понятие "родовые пути" включает
519;38;Ширина и окружность бедер доношенного плода составляют
520;38;Положение плода определяется
521;38;Позиция плода определяется
522;38;Вид плода определяется
523;38;Членорасположение плода определяется как
524;38;Укажите все возможные варианты положения плода
525;38;Членорасположение плода бывает
526;38;Вставление головки определяется
527;38;Костный таз делится
528;38;Большой родничок образуют швы
529;39;В поликлинику явилась больная с послеродовым правосторонним маститом в стадии серозного воспаления. Какое лечение нецелесообразно?
530;39;Нельзя отнести к первично-хроническому остеомиелиту:
531;39;В какие сроки на рентгенограммах появляются признаки остеопороза у больных с острым гематогенным остеомиелитом?
532;39;В какие сроки на рентгенограммах появляются линейные просветления у больных с гематогенным остеомиелитом?
533;39;В первую очередь следует искать первичный очаг воспаления при остром гематогенном остеомиелите:
534;39;Нельзя считать характерным для начального периода острого гематогенного остеомиелита:
535;39;Введение профилактической дозы противостолбнячной сыворотки не показано:
536;39;Не является характерным для картины острой фазы столбняка:
537;39;К ранним симптомам столбнячной инфекции не следует относить:
538;39;К местным признакам туберкулезного поражения тазобедренного сустава не следует относить:
539;39;Вторичное заживление раны наблюдается при заживлении через:
540;39;В какие сроки выполняется поздняя хирургическая обработка инфицированной раны?
541;39;В какие сроки выполняется отсроченная хирургическая обработка инфицированной раны?
542;39;В какие сроки осуществляют раннюю хирургическую обработку раны?
543;40;В структуре заболеваемости наибольший удельный вес составляет
544;40;Показателем средней продолжительности пребывания больного на койке является
545;40;На среднюю продолжительность пребывания больного на койке влияет
546;40;К качественным показателям деятельности стационара относятся все перечисленные, кроме
547;40;Деонтология - наука о долге врача и среднего медицинского персонала, который состоит в том, чтобы
548;40;Этические нормы врача определяются:
549;40;Отделение (группа) анестезиологии-реанимации организуется в следующих лечебных учреждениях
550;40;Палаты для реанимации и интенсивной терапии организуются в указанных ниже больницах, за исключением:
551;40;Палаты реанимации и интенсивной терапии организуются в городских больницах
552;40;Палаты реанимации и интенсивной терапии организуются в центральных районных больницах
553;40;В лечебно-профилактическом учреждении имеется хирургическое отделение для взрослых на 75 коек. Сколько должностей врачей анестезиологов-реаниматологов должно быть выделено для этой больницы?
554;40;В составе лечебно-профилактического учреждения имеется туберкулезное легочно-хирургическое отделение на 50 коек. Сколько должностей врачей анестезиологов-реаниматологов должно быть в этом отделении?
555;40;В составе лечебно-профилактического учреждения имеется ожоговое отделение на 100 коек. Сколько должностей врачей анестезиологов- реаниматологов должно быть в этом отделении?
556;40;В небольшом городе суммарная мощность отделений хирургического профиля для взрослых не превышает 70 коек. Сколько должностей врачей анестезиологов-реаниматологов может получить одна из больниц?
557;41;Везикулярное дыхание выслушивается на
558;41;При эмфиземе легких дыхание
559;41;Крепитация характерна для
560;41;Для крупозной пневмонии в разгар болезни характерен перкуторный звук
561;41;Бронхиальное дыхание выслушивается на
562;41;Амфорическое дыхание наблюдается при
563;41;Ослабление голосового дрожания характерно для
564;41;Усиление голосового дрожания типично для
565;41;Пульс  tardus, parvus характерен для
566;41;Наличие у больного положительного венного пульса характерно для
567;41;Наиболее вероятная причина значительного расширения абсолютной тупости сердца
568;41;Значительное расширение сердца влево и вниз наблюдается при дилатации
569;41;Кровохарканье чаще всего наблюдается при
570;42;Подострый тиреоидит /тиреоидит де Кервена/ является следствием:
571;42;Для клинической картины при подостром тиреоидите /тиреоидит де Кервена/ характерно:
572;42;Для подострого тиреоидита /тиреоидита де Кервена/ характерно:
573;42;Для лечения подострого тиреоидита /тиреоидита де Кервена/ используют:
574;42;В исходе подострого тиреоидита /тиреоидита де Кервена/:
575;42;В исходе аутоиммунного тиреоидита развивается:
576;42;Для диагностики аутоиммунного тиреоидита необходимо:
577;42;Наиболее оптимальной лечебной тактикой при подостром тиреоидите является:
578;42;Для субклинического гипотиреоза характерно:
579;42;Для диффузного токсического зоба характерно:
580;43;Угол Белера представляет собой:
581;43;Переломом Джонса называют:
582;43;Типичный механизм переломов костей переднего отдела стопы:
583;43;Типичный механизм перелома пяточной кости:
584;43;В трехсуставной артродез стопы включают суставы:
585;43;Наиболее частая причина посттравматического продольного плоскостопия:
586;43;Типичное смещение дистального отломка во фронтальной плоскости при переломе пяточной кости:
587;43;Разрыва сухожилия задней большеберцовой может привести к:
588;43;Типичное смещение дистального отломка в сагиттальной плоскости при переломе пяточной кости:
589;43;Положение стопы при иммобилизации перелома пяточной кости после репозиции отломков:
590;43;Аваскулярный некроз кости является типичным осложнением перелома:
591;43;При артродезе подтаранного сустава оптимальным доступом является:
592;44;Право образовательного учреждения на выдачу своим выпускникам документа государственного образца о соответствующем уровне образования возникает с момента его …
593;44;Граждане Российской Федерации имеют право на получение ___ образования на родном языке
594;44;Законодательство Российской Федерации в области образования не включает в себя …
595;44;Государственный образовательный стандарт в условиях современной системы образования по Закону Российской Федерации «Об образовании»…
596;44;В соответствии с Законом «Об образовании» Российской Федерации формой получения образования не является …
597;44;Дополнительное образование в соответствии с Законом Российской Федерации «Об образовании» предполагает …
598;44;Образование, имеющее целью подготовку работников квалифицированного труда по всем основным направлениям общественно-полезной деятельности на базе основного общего образования, является ___ образованием
599;44;Целью «Программы развития педагогического образования России на 2001-2010 годы» является …
600;44;У образовательного учреждения возникает право на образовательную деятельность с момента…
601;44;К ведущим принципам разработки содержания непрерывного педагогического образования не относится …
602;44;Общее руководство государственным или муниципальным высшим учебным заведением осуществляет ___ совет
603;44;К приоритетным задачам модернизации российского образования не относится …
604;44;Документ, защищающий права ребенка и имеющий обязательную силу для подписавших его стран, - это …
605;45;Совокупность норм обычного права мусульманских народов:
606;45;Древний орган государственного управления в Афинах:
607;45;Название официальной систематизации византийского права:
608;45;Высшая варна в Древней Индии, рожденная из уст Бога:
609;45;Система отношений личной зависимости в средневековой Европе:
610;45;Высший сословно-представительный орган во Франции:
611;45;Совет гэнро:
612;45;Форма государства в странах Древнего Востока:
613;45;Новое дворянство в Англии:
614;45;Экстраординарная магистратура в Древнеримской республике:
615;45;Институт доверительной собствености, возникший в средневековой Англии:
616;45;Закон Вагнера регулирует:
617;45;Новый курс Рузвельта: