id;testId;query
325;21;Экономическая информация — это:
326;21;Классификация экономической информации позволяет:
327;21;Методами классификации экономической информации являются:
328;21;Данные — это:
329;22;﻿ К экзогенно-органическим психическим заболеваниям относят:
330;22;В течении травматической болезни выделяют следующие периоды:
331;22;"Сквозными" психическими расстройствами при черепно-мозговой травме являются:
332;22;Для начального периода черепно-мозговой травмы наиболее характерны следующие психические расстройства (синдромы):
333;22;К острым (подострым) травматическим психозам относятся:
334;22;Наиболее часто встречающимся травматическим психозом острого периода является:
335;22;При травме воздушной взрывной волной наиболее специфичными психическими расстройствами являются:
336;22;Для всех больных с черепно-мозговой травмой обязательным является назначение:
337;22;Эпилепсия относится к:
338;22;Аура является:
339;22;Последовательность стадий большого судорожного припадка следующая:
340;22;"Джексоновский" припадок относится к:
341;22;Для больных эпилепсией характерна:
342;23;Что является самым частым осложнением стрессовой язвы желудка?
343;23;Абсолютным показанием к операции при гастродуоденальных язвах является:
344;23;Кто из хирургов Военно-медицинской академии был удостоен Государственной премии СССР за внедрение ваготомии в хирургическую практику?
345;23;По отнощению к брюшине червеобразный отросток расположен:
346;23;Какое наиболее частое расположение червеобразного отростка?
347;23;Hаибольшее распространение в хирургической практике нашла классификация острого аппендицита:
348;23;Какая наиболее частая окончательная локализация болей при остром аппендиците?
349;23;Первичная локализация болей в подложечной области особенно часто наблюдается при:
350;23;Температура тела при остром аппендиците, как правило, колеблется в пределах:
351;23;"Пахово-мошоночный симптом" для определения воспалительного состояния брюшины при остром аппендиците называется симптомом:
352;23;"Симптом скольжения" для диагностики острого аппендицита впервые предложил:
353;23;Диагностические ошибки при остром аппендиците в основном объясняются:
354;23;Hаиболее часто симулирует острый аппендицит:
355;24;Законники, представители официального духовенства в Средней Азии - это ...
356;24;Кто такие "багауды"?
357;24;Кого в древнем Риме называли "колонами"?
358;24;Что отражает выражение "Пойти в Каноссу"?
359;24;Поступательное движение человеческого общества от низших ступеней к высшим называется ...
360;24;Реакционная идеология и политика, направленные на подготовку новой войны с целью отплатить за понесенное поражение и вернуть утраченные позиции называется ...
361;24;Что означает бантустан?
362;24;"Деспотия" в переводе с греческого означает ...
363;24;Как в древнегреческих источниках называлась населенная часть, граница Земли?
364;24;Антропологи - это ... 1) ученые, изучающие вещественные источники; 2) специалисты по изучению древних языков и генеалогии; 3) ученые, изучающие материальную культуру людей, их быт и образ жизни; 4) специалисты, восстанавливающие внешний облик древних людей по их останкам; 5) ученые, производящие раскопки стоянок первобытных людей; 6) специалисты, изучающие проблемы происхождения и развития человека.
365;24;Что означает в переносном смысле выражение "ахиллесова пята"?
366;24;Как назывался священный напиток зороастрийцев, смешанный с молоком?
367;24;Скунха это ...
368;24;Чоппер это ...
369;25;﻿Основными задачами концепции развития здра¬воохранения и медицинской науки в РФ являются:
370;25;При обращении за медицинской помощью и ее получении пациент имеет право на:
371;25;Информация о состоянии здоровья предостав¬ляется гражданину:
372;25;В случае неблагоприятного прогноза информа¬ция деликатным способом сообщается:
373;25;Информация, которую пациент имеет право получить в доступной для него форме:
374;25;С медицинской документацией о своем здоро¬вье гражданин имеет право:
375;25;Без согласия гражданина или его представите¬ля медицинское вмешательство допускается при заболеваниях:
376;25;Действия или средства для удовлетворения просьбы пациента об ускорении его смерти - это:
377;25;Медицинскому персоналу осуществлять эвта¬назию:
378;25;Отказ от медицинского вмешательства с ука¬занием возможных последствий оформляется в ме¬дицинской документации с подписью:
379;25;Возмещение ущерба в случае причинения вреда здоровью пациента при оказании медицинской помощи законом:
380;26;Наиболее характерный симптом, указывающий на раковое перерождение при хроническом эзофагите:
381;26;К препаратам, снижающим желудочно-пищеводный рефлюкс, не относится:
382;26;При лечении ахалазии пищевода противопоказано применять:
383;26;Рентгенологически выявленное отсутствие перистальтики в дистальном отделе пищевода при нормальной моторике в проксимальном отделе характерно для:
384;26;Наличие желудочной метаплазии нижнего пищеводного сфинктера характерно для:
385;26;При рефлюкс-эзофагите применяют: а) нитроглицерин; б) мотилиум; в) но-шпу; г) де-нол; д) маалокс; е) ранитидин. Выберите правильную комбинацию:
386;26;К основным методам исследования, позволяющим верифицировать диагноз хронического гастрита, не относится:
387;26;Наличие триады симптомов - стойкое повышение желудочной секреции, изъязвление ЖКТ, диарея - указывает на:
388;26;О степени активности гастрита судят по клеточной инфильтрации слизистой оболочки желудка:
389;26;Для клиники хронического гастрита характерно:
390;27;В репродуктивной системе
391;27;В репродуктивной системе
392;27;В репродуктивной системе
393;27;В репродуктивной системе
394;27;Преовуляторные изменения гормонального фона характеризуются повышением уровня
395;27;Физиологические процессы в яичнике могут быть оценены с помощью
396;27;В первой фазе менструального цикла
397;27;В первой фазе менструального цикла
398;27;Во второй фазе менструального цикла
399;27;Циркадный ритм секреции характерен
400;27;Цирхоральный ритм секреции характерен
401;27;Зрелость фолликула можно определить
402;28;Артериальная гипертензия может быть заподозрена по следующим клиническим признакам и проявлениям:
403;28;Основным признаком нефрогенной гипертензии является:
404;28;Эндокринная гипертензия с дефицитом гормональной продукции является:
405;28;Гипертензия при коарктации аорты развивается вследствие:
406;28;Повышение артериального давления при феохромоцитоме и парананглиомах имеет характер:
407;28;Основным гемодинамическим признаком коарктации грудного отдела аорты является:
408;28;Вазоренальная гипертензия развивается вследствие:
409;28;Снижение уровня АД при асимметрии АД на правой и левой руках до нормальных цифр опасно в плане:
410;28;Абсолютным диагностическим критерием артериальной гипертензии при феохромоцитоме является:
411;28;Гормоном с высокой прессорной активностью является:
412;28;В пульмонологической практике препаратами, вызывающими развитие артериальной гипертензии, являются:
413;28;При лечении хронических артритов развитие артериальной гипертензии может вызвать:
414;29;Для холеры характерно сочетание симптомов:
415;29;Генерализованную форму сальмонеллеза от локализованной отличают симптомы:
416;29;Для гастроинтестинальной формы иерсиниоза характерны симптомы:
417;29;Укажите, какие варианты продромального периода встречаются при гепатите В:
418;29;Укажите причину кишечного кровотечения при брюшном тифе:
419;29;Цитолиз печеночных клеток при вирусных гепатитах отражают следующие биохимические тесты:
420;29;Какие ферменты отражают холестаз при вирусных гепатитах?
421;29;Какое звено патогенеза определяет тяжесть течения холеры?
422;29;Какие серологические маркеры характерны для гепатита А в остром периоде болезни?
423;29;Какой из серологических маркеров не характерен для гепатита В?
424;30;Антисептиками группы окислителей являются: а) хлоргексидина биглюконат; б) калия перманганат; в) перекись водорода; г) диоксидин; д) йодопирон. Выберите правильную комбинацию ответов:
425;30;Антисептиками, относящимися к группе галогенов и галогенсодержащих соединений, являются: а) калия перманганат; б) гипохлорит натрия; в) диоксидин; г) повидонйод; д) йодонат. Выберите правильную комбинацию ответов:
426;30;Какие методы относятся к физической антисептике? а) ультразвуковая кавитация раны; б) антибиотико-новокаиновая блокада гнойно-воспалительного очага; в) вакуумная аспирация; г) обработка ран раствором эффективного антисептика; д) использование лазерного излучения. Выберите правильную комбинацию ответов:
427;30;Пути эндогенной контаминации ран: а) через нестерильный хирургический инструментарий; б) проникновение непосредственно из полого органа; в) через руки медицинского персонала; г) через бактериально контаминированный экссудат брюшной полости; д) с током лимфы или крови из гнойно-воспалительного очага. Выберите правильную комбинацию ответов:
428;30;Что из перечисленного относится к методам профилактики контактного пути распространения микрофлоры? а) стерилизация белья; б) стерилизация инструментов; в) стерилизация шовного материала; г) обработка рук хирурга; д) обработка операционного поля. Выберите правильную комбинацию ответов:
429;30;Действие протеолитических ферментов при гнойных процессах заключается в: а) лизисе некротизированных тканей; б) повышении свертываемости крови; в) фибринолизе; г) по-тенцировании действия антибиотиков; д) антибактериальном действии; е) противовоспалительном действии. Выберите пра-вильную комбинацию ответов:
430;30;К экзогенным источникам контаминации операционных ран относятся:  а) бактериально  контаминированный  экссудат брюшной полости; б) бактерионосительство среди медицинского персонала; в) несанированные очаги хронической инфекции у больного; г) микробная загрязненность рук хирургов и инструментария; д) микробная загрязненность воздуха операционных залов, палат и перевязочных; е) бактериальная контаминация кишечника. Выберите правильную комбинацию ответов:
431;30;Организационные мероприятия асептики включают: а) использование одноразового белья, шовного материала, инструментария; б) дезинфекцию рук персонала перед каждым кон-тактом с больным и после него; в) выявление и санацию бактерионосителей в стационаре; г) первичную хирургическую обработку ран; д) применение антибиотиков; е) обработку опе-рационных ран эффективным антисептиком. Выберите правильную комбинацию ответов:
432;30;К эфирным анестетикам относятся: а) лидокаин; б) дикаин; в) кокаин; г) тримекаин; д) меркаин; е) новокаин. Выберите правильную комбинацию ответов:
433;30;Для амидных анестетиков характерно: а) быстрое гидролитическое разрушение в тканях; б) продолжительность эффективной регионарной анестезии при однократном введении в ткани; в) допустимость повторного введения значительных доз препарата для продления анестезии; г) практически не вызывают аллергических реакций в максимально допустимых дозах; д) выводятся из организма в неизмененном виде или под-вергаются частичному разрушению в печени. Выберите правильную комбинацию ответов:
434;30;Для эфирных анестетиков характерно: а) быстрое гидролитическое разрушение в тканях; б) продолжительность эффективной регионарной анестезии при однократном введении в ткани; в) допустимость повторного введения значительных доз препарата для продления анестезии; г) практически не вызывают аллергических реакций в максимально допустимых дозах; д) выводятся из организма в неизмененном виде или под-вергаются частичному разрушению в печени. Выберите правильную комбинацию ответов:
435;30;Какие из перечисленных видов местного обезболивания относятся к проводниковой анестезии? а) футлярная анестезия; б) анестезия по Оберсту-Лукашевичу; в) паранефральная бло-када; г) блокады нервных сплетений и стволов; д) перидуральная анестезия; е) анестезия по Брауну; ж) терминальная анестезия. Выберите правильную комбинацию ответов:
436;31;Назовите основные методы изучения заболеваемости населения:
437;31;К показателям заболеваемости относятся все перечисленные показатели, кроме:
438;31;Что характеризует показатель общей заболеваемости?
439;31;Назовите данные, необходимые для расчета первичной заболеваемости:
440;31;Назовите данные, необходимые для расчета общей заболеваемости:
441;31;Какой документ используют для изучения заболеваемости по обращаемости?
442;31;Назовите данные, необходимые для расчета патологической пораженности:
443;31;Назовите данные, необходимые для расчета структуры заболеваемости:
444;31;Какой документ используют при статистической разработке заболеваемости?
445;31;Какой документ используют для изучения инфекционной заболеваемости?
446;31;Какой документ используют для изучения заболеваемости злокачественными новообразованиями?
447;31;Назовите основные направления демографии:
448;32;Глотка расположена:
449;32;Перечислите отделы глотки:
450;32;Укажите миндалины, расположенные в носоглотке:
451;32;Перечислите миндалины, образующие лимфаденоидное глоточное кольцо Вальдеера-Пирогова:
452;32;Анатомические образования, с которыми латерально граничит глотка:
453;32;Выберите из указанных нозологических форм банальные ангины:
454;32;Перечислите ангины при заболеваниях крови:
455;32;Укажите возможные осложнения ангин:
456;32;Перечислите типичные признаки катаральной ангины:
457;32;Перечислите симптомы, характерные для фолликулярной ангины:
458;32;Перечислите симптомы, характерные для дифтерии глотки:
459;32;Какие из указанных симптомов характерны для фарингита?
460;33;Основные структурные оболочки глазного яблока:
461;33;Переднезадний размер глазного яблока при эмметропии в среднем равен:
462;33;"Слабое" место в переднем отрезке глазного яблока при его контузиях:
463;33;Толщина роговицы от центра к периферии:
464;33;Наиболее тонкая часть склеры в заднем отрезке глазного яблока:
465;33;Функция роговицы:
466;33;Функция склеры:
467;33;Функция ресничного тела:
468;33;Функция радужки:
469;33;Функция хориоидеи:
470;33;Функция сетчатки:
471;33;Функция хрусталика:
472;33;Преломляющая сила роговицы:
473;34;Этиология - это:
474;34;Реакции организма, возникающие при гипотермии в фазу компенсации: а) спазм периферических сосудов; б) расширение периферических сосудов; в) увеличение гликогенолиза в печени; г) увеличение потоотделения; д) мышечная дрожь (озноб).
475;34;Для первых 6 часов острой лучевой болезни у взрослого, однократно тотально облученного в дозе 2-6 Гр, характерны: а) тошнота, рвота; б) лимфоцитопения; в) нейтрофильный лейкоцитоз; г) кровоточивость; д) эритема; е) анемия.
