id;testId;query
1;1;Определите древние города Западного Судана.
2;1;В каком году была создана Организация африканского единства, сыгравшая большую роль в борьбе за независимость народов Африки?
3;1;В каком государстве Африки в 1950 г. был принят закон о регистрации населения, согласно которому все жители страны классифицировались по расовому признаку?
4;1;Сколько царств существовало на территории Египта, до того, как возникли Северный и Южный Египет?
5;1;Колониями какой страны были Конхинхину и Камбоджа?
6;1;Кто из президентов Египта провозгласил политику "открытых дверей" и "либерализации" экономики?
7;1;Олдувай, где обнаружены древнейшие орудия труда и кости древнейших людей, находится ...
8;1;Абиссиния - это ...
9;1;Когда Эфиопия была объявлена колонией Италии?
10;1;В каком году было подписано соглашение о предоставлении Алжиру независимости?
11;1;В XVII-ХIХ вв. Тропическая Африка была разделена между Европейскими государствами на колониальные территории. Определите колонии принадлежащие Франции. 1) Дагомея; 2) Ангола; 3) Руанда; 4) Кения; 5) Чад; 6) Мозамбик; 7) Сенегал.
12;1;Какие из перечисленных стран были странами-колонизаторами Африки в середине XIX в.?
13;1;Какие территории Африки вошли в состав Османской Империи в ХVI -ХVII вв.?
14;1;Какие африканские страны охватила волна "социалистической ориентации" в 70-е гг. XX в.?
15;1;Африканские колонии Великобритании в начале XX в.:
16;1;Владения Арабского халифата в Африке ограничивались ...
17;1;Какой территорией ограничивались знания древних римлян об Африке?
18;1;В каком из средневековых городов Африки был открыт университет, где кроме богословия изучали историю, математику и астрономию?
19;1;В конце XIX в. большинство стран Африки потерпели поражение в борьбе против колонизаторов и лишь одной в 90-х годах, удалось отстоять свою независимость. Эта страна - ...
20;1;Какое государство основало Капскую колонию на юге Африки?
21;1;Какая из перечисленных стран Африки получила независимость раньше других?
22;1;В каком году в Южной Африке было создано политическое движение "Африканский национальный конгресс"?
23;1;Памятник архитектуры средневековья - императорский дворец в Гондэре - расположен в ... (по состоянию на 1998 г.)
24;1;Южно-Африканский союз, созданный в 1910 г., объединил ...
25;1;Какая африканская колония принадлежала Германии, кроме Юго-Западной Африки?
26;1;Укажите древнее государство, существовавшее на севере нынешней Эфиопии.
27;1;В марте 1990 г. была провозглашена ...
28;2;Признаки государства - это:
29;2;Конституция РФ была принята:
30;2;Источниками права являются:
31;2;Юридическими функциями права являются:
32;2;В судебную власть входят:
33;2;Правоспособность у физического лица возникает:
34;2;Возможна ли пересадка органов и (или) тканей реципиенту без его согласия либо без согласия его родителей или законного представителя?
35;2;Предоставление сведений, составляющих врачебную тайну, без согласия пациента допускается:
36;2;Какие сведения составляют врачебную тайну?
37;2;Лицензия - это:
38;2;Право на занятие частной медицинской практикой может быть реализовано в РФ при наличии:
39;2;Работники с высшим медицинским или фармацевтическим образованием могут быть допущены к практической деятельности после прохождения переподготовки или на основании проверочного испытания, если они не работали по своей специальности:
40;2;Основополагающий правовой акт в области здравоохранения:
41;2;Какие из перечисленных прав, закрепленных в Конституции РФ, относятся к личным?
42;2;Субъектом незаконного производства аборта является:
43;3;Социальные группы в древнерусском обществе:
44;3;Ограниченно свободные люди в Древней Руси:
45;3;Органы государственной власти Киевской Руси
46;3;4.Система государственного управления в Киевской Руси:
47;3;Русская Правда представляет собой:
48;3;Собственность на землю по Русской Правде:
49;3;Правовое значение общины (верви) в древнерусском праве:
50;3;Виды договоров по Русской Правде:
51;3;Термин, обозначающий преступление в Русской Правде:
52;3;Основная цель наказания по Русской Правде:
53;3;Виды наказаний по Русской Правде:
54;3;Досудебные процедуры в древнерусском судебном процессе.
55;3;Виды доказательств в древнерусском судебном процессе.
56;4;По указу 1760-го г. дворяне получили право:
57;4;Личные права дворян включали право на:
58;4;Имущественное(-ые) право(-а) дворян включало(-и) в себя:
59;4;Правовой статус городского населения как особого сословия начал определяться:
60;4;Все городское население делилось на:
61;4;От телесных наказаний освобождались:
62;4;В 1803 г. принимается «Указ о вольных хлебопашцах», по которому помещики получали право:
63;4;Первые годы правления Александра I характеризовались возрождением политики:
64;4;В 1809 г. подготовить проект Конституции было поручено:
65;4;В 1811 г. издается «Общее учреждение министерств» - документ, подготовленный:
66;4;Назовите выдающегося русского правоведа и государственного деятеля. Именно под его руководством было составлено Полное собрание законов Российской Империи. Подготовил план государственных преобразований – «Введение к уложению государственных законов»:
67;4;В функции жандармерии входило:
68;4;В 1837 г. реорганизуется система полицейских органов: связи с делением уездов на более мелкие административно-территориальные единицы появляется такая полицейская должность как:
69;4;Разработка положений о церкви, осуществленная Уложенной комиссией 1754 г., затронула ряд существенных вопросов господствующего положения православной веры. Отход от православия, совращение в нехристианскую веру, богохульство наказывались:
70;4;В 1826 г. Уложенная комиссия была преобразована во Второе отделение Собственной канцелярии Его Величества, делами которого фактически ведал М. М. Сперанский. Юридическая техника для составления Свода основывалась на методике включавшей в себя то, что:
71;4;Разделение законов, по мысли М. М. Сперанского, основывались на осуществлении двух правовых порядков:
72;4;В Полное собрание законов (ПСЗ) вошло:
73;4;В 1847 г. рабочий день для фабричных рабочих был снижен до _______ часов
74;4;Запродажа имущества – это:
75;4;Договор товарищества первой половины XIX в. в новых экономических условиях получил широкое распространение. А сколько видов товарищества предусматривалось на то время:
76;4;Для возникновения товарищества требовалась регистрация. Для возникновения акционерного общества –
77;4;Для православного брака требовалось достижение брачного возраста, а именно
78;4;В сфере общественного права завещательная свобода:
79;4;«Уложение о наказаниях уголовных и исправительных» (1845 г.) предусматривало:
80;4;Наказания подразделялись на:
81;4;К важнейшим преступлениям относились:
82;5;Что является предметом философии права по мнению Трубецкого?:
83;5;Предмет философии права по Тихонравову:
84;5;З. Какое место отводит Шершеневич философии права в системе наук?
85;5;Философия права в системе юридических наук по мнению Керимова:
86;5;Точка зрения Нсрсссяица по вопросу о системе курса "Философии права":
87;5;Шершеневич Г.Ф. считал, что теоретическая задача философии права заключается:
88;5;По мнению Е.П. Трубецкого одним из важных вопросов философии права является:
89;5;З. Профессор права С.С. Алексеев предмет философии права трактует, как:
90;5;По мнению Б.А. Керимова предмет философии права можно охарактеризовать как:
91;5;В.С. Нерсесянц считает, что предметом философии права является:
92;5;Свою философско-правовую позицию Б.Н. Чичерин называл:
93;5;В своих философско-правовых исследованиях Б.Н. Чичерин применяет:
94;5;З. Новгородцев П.И. в понимании права и государства разделял основные идеи:
95;5;Возникновение права В.С. Соловьев трактует в духе:
96;5;Философско-правовая концепция христианского персонализма разработана:
97;5;Античная философия права раннего периода характеризуется творчеством:
98;5;В основе права, согласно Цицерону, лежат:
99;5;Говорит о "специальной справедливости" и различает два вида ее проявления:
100;5;Говорит о справедливости как "надлежащей мере" и различает два вида равенства:
101;5;Римские юристы сформулировали принципиально важное положение о делении права на:
102;5;Юридическая аксиология, это учение о:
103;5;Исходным пунктом развития аксиологии послужило:
104;5;З. К аксилогическим принципам относятся:
105;5;Согласно естественно-правовой аксиологии, естественное право выступает в виде:
106;5;Либертарно-юридическая аксиология проповедует идею:
107;6;Педагогика это:
108;6;Какие задачи ставятся перед педагогической наукой?
109;6;Что определило развитие педагогики как науки?
110;6;это то, что остается, когда все забыто.
111;6;Процесс воспитания это:
112;6;Отражение человеком объективной действительности в форме фактов, представлений, понятий и законов науки это:
113;6;Обучение это:
114;6;Целью воспитания является:
115;6;Традиционными методами исследования в педагогике являются:
116;6;Отраслью педагогики не является:
117;6;Мировую славу русской педагогике принес:
118;6;Основу обучения составляют:
119;6;Социализация это-
120;6;Не является ученым-педагогом:
121;6;Основой для образования педагогики как науки являлась:
122;6;Ведущая категория педагогики это -
123;6;Процесс целепологания подразумевает:
124;6;Педагогический процесс это:
125;6;Компонентами педагогического процесса являются:
126;6;Главной целью образования является:
127;6;Целостность педагогического процесса заключается в:
128;6;Определяющим фактором при постановке цели воспитания является:
129;6;Педагогику как самостоятельную науку выделил:
130;6;Формирование ценностного отношения в жизни, обеспечивающего устойчивое и гармоничное развитие личности (воспитание чувства долга, справедливости, искренности, ответственности и других качеств, способных придать высший смысл делам, мыслям и чувствам человека) это-
131;6;Закон параллельного действия заключается в том, что:
132;6;Основными категориями педагогики являются:
133;6;Процесс становления человека как социального существа под воздействием всех без исключения факторов – экологических, социальных, экономических, идеологических, психологических и т.д., достижение уровня зрелости, устойчивости это -
134;7;Понятие «абсолютно черное тело» получено с помощью логической операции:
135;7;Сборник логических трактатов Аристотеля называется:
136;7;Отношение знака к обозначающему объекту исследует:
137;7;Из перечисленных выражений квантор существования задается только выражением:
138;7;«Космонавт» это:
139;7;Какое из указанных выражений является суждением?
140;7;Какое из следующих понятий является непустым?
141;7;Объемы какой пары понятий соотносятся так, как на следующей схеме:
142;7;Какой из законов логики нарушен в следующем примере: «Что это вы все время смеетесь? – А что же мне плакать, что?»
143;7;Какой из законов логики нарушен в следующем требовании: «За сборную должны выступать только игроки уже имеющие опыт игры за сборную»?
144;7;Какое из указанных определений является перациональным?
145;7;Какая ошибка допущена в следующем определении: «Человек это двуногое живое без перьев»?
146;7;Какая логическая операция выполнена в следующем примере: «Ни один крокодил не живет в Амуре. Следовательно, все живущие в Амуре – не крокодилы»?
147;7;Какое из следующих суждений является выделяющим:
148;7;Какая ошибка допущена в следующем простом категорическом силлогизме: «Некоторые китайцы живут в Хабаровске. Некоторые хабаровчане учатся в ХГТУ. Следовательно, среди студентов ХГТУ есть китайцы»?
149;7;К какому типу умозаключением относится следующее выражение: «Если ты будешь говорить правду, тебя возненавидят люди. Если ты будешь лгать, тебя возненавидят боги. Но ты можешь или лгать, или говорить правду. Следовательно, или тебя возненавидят люди, или тебя возненавидят боги»?
150;7;Какую фигуру имеет следующий простой категорический силлогизм: «Ни один лжец не заслуживает доверия. Всякий добропорядочный человек заслуживает доверия. Следовательно, не один добропорядочный человек не лжец»?
151;7;Какая ошибка допущена в следующей аргументации: «Немецкий физик В. Нерст, автор третьего начала термодинамики, следующим образом «доказывал», что ему удалось завершить разработку фундаментальных законов термодинамики: у первого начала ти автора (Майер, Джоуль Гемгольц), у второго – два (Карно и Каузиус), у третьего – один (Нерст); следовательно, число авторов четвертого начала должно равняться нулю, т.е. такого закона не может быть»?
152;7;Какой метод установления причинных связей был использован в следующем примере: «В прошлом веке считали. Что животным для поддержания жизни необходимо потреблять лишь белки и соли. Это мнение опроверг в 1880 г. доктор Н.И. Лунин. Он проделал следующий опыт. Одну группу мышей кормил обычной пищей, а другую очищенными белками и солями. Мыши второй группы через некоторое время погибли. Лунин сделал вывод о том, что животным кроме белков и солей нужно еще что-то. Затем этот недостающий компонент питания был открыт. Им оказались витамины»?
153;7;«Если произошло самоубийство, то не было несчастного случая и убийства. В данном случае было убийство. Значит, не было несчастного случая и самоубийства». Данное рассуждение представляет из себя:
154;7;Какой из следующих вопросов синтаксически некорректным:
155;7;Какой ответ на вопрос «Почему аборигены съели Кука?» является нерелевантными:
156;8;Что реально является объектом медицины как науки?
157;8;Какую из медицинских теорий можно считать фундаментальной основой теории общей патологии?
158;8;Как можно оценить природу человека?
159;8;Если возможна общая междисциплинарная теория человека, то какие из перечисленных дисциплин должны составить ее основание?
160;8;К какой из фундаментальных концепций пространства и времени относятся понятия «биологическое время» и «биологическое пространство», «психологическое время»?
161;8;К каким типам диагностики можно отнести компьютерную диагностику?
162;8;Какие из этиологических концепций современной медицины можно оценить как вариант механистического детерминизма?
163;8;Какие из перечисленных методов относятся к эмпирическому уровню научного исследования?
164;8;Какие из перечисленных методов относятся к теоретическому уровню научного исследования?
165;8;В современной медицине, как в любой другой науке, есть две формы научного рационализма, символами которых выступают герои «Фауста» Гете. Кто из них и почему олицетворяет, с Вашей точки зрения, современную науку?
166;8;К. Маркс, анализируя усиливающуюся специализацию научных исследований, называл последствия этого процесса «профессиональным кретинизмом». Характерен ли этот феномен, с Вашей точки зрения, для современной медицины?
167;8;Совпадают ли по смыслу понятия «норма» и «сущность» здоровья?
